<?xml version="1.0" encoding="UTF-8"?>
<treasures xmlns="http://epam.com/treasures"
           xmlns:xsi="http://www.w3.org/2001/XMLSchema-instance"
           xsi:schemaLocation="http://epam.com/treasures treasure.xsd">
    <treasure>
        <jewel id="11">
            <type>Precious stone</type>
            <material>Diamond</material>
            <diameter>1.2</diameter>
            <weight>0.015</weight>
            <price>324.57</price>
        </jewel>
    </treasure>
    <treasure>
        <jewel id="12">
            <type>Precious stone</type>
            <material>Ruby</material>
            <diameter>5.1</diameter>
            <weight>0.051</weight>
            <price>117</price>
        </jewel>
    </treasure>
    <treasure>
        <jewel id="13">
            <type>Halfprecious stone</type>
            <material>Opal</material>
            <diameter>35.4</diameter>
            <weight>0.156</weight>
            <price>257.3</price>
        </jewel>
    </treasure>
    <treasure>
        <ring id="21">
            <material>Gold</material>
            <weight>2.7</weight>
            <style>Classic</style>
            <hasPreciousStone>true</hasPreciousStone>
            <price>751</price>
        </ring>
    </treasure>
    <treasure>
        <ring id="22">
            <material>Platinum</material>
            <weight>6.1</weight>
            <style>Vintage</style>
            <hasPreciousStone>false</hasPreciousStone>
            <price>1024.33</price>
        </ring>
    </treasure>
    <treasure>
        <ring id="23">
            <material>Silver</material>
            <weight>5.34</weight>
            <style>Vintage</style>
            <hasPreciousStone>false</hasPreciousStone>
            <price>99.99</price>
        </ring>
    </treasure>
    <treasure>
        <bracelet id="31">
            <material>Silver</material>
            <weight>12.3</weight>
            <style>Classic</style>
            <girth>19.7</girth>
            <hardness>Hard</hardness>
            <price>230.69</price>
        </bracelet>
    </treasure>
    <treasure>
        <bracelet id="32">
            <material>Gold</material>
            <weight>13.1</weight>
            <style>Vintage</style>
            <girth>21.2</girth>
            <hardness>Medium hardness</hardness>
            <price>538.29</price>
        </bracelet>
    </treasure>
    <treasure>
        <bracelet id="33">
            <material>Steel</material>
            <weight>11.9</weight>
            <style>Classic</style>
            <girth>20.2</girth>
            <hardness>Hard</hardness>
            <price>214.99</price>
        </bracelet>
    </treasure>
    <treasure>
        <chain id="41">
            <length>0.4</length>
            <weight>0.02</weight>
            <material>Gold</material>
            <thickness>0.01</thickness>
            <type_of_lock>Springring</type_of_lock>
            <price>455</price>
        </chain>
    </treasure>
    <treasure>
        <chain id="42">
            <length>0.35</length>
            <weight>0.016</weight>
            <material>Silver</material>
            <thickness>0.01</thickness>
            <type_of_lock>Lobster</type_of_lock>
            <price>130</price>
        </chain>
    </treasure>
    <treasure>
        <chain id="43">
            <length>0.45</length>
            <weight>0.034</weight>
            <material>Gold</material>
            <thickness>0.014</thickness>
            <type_of_lock>Barrel</type_of_lock>
            <price>455</price>
        </chain>
    </treasure>
    <treasure>
        <sandglass id="51">
            <material>Steel</material>
            <sand_type>River sand</sand_type>
            <weight>14</weight>
            <price>128</price>
        </sandglass>
    </treasure>
    <treasure>
        <sandglass id="52">
            <material>Gold</material>
            <sand_type>River sand</sand_type>
            <weight>15.5</weight>
            <price>441</price>
        </sandglass>
    </treasure>
    <treasure>
        <sandglass id="53">
            <material>Platinum</material>
            <sand_type>Quarry sand</sand_type>
            <weight>13</weight>
            <price>389</price>
        </sandglass>
    </treasure>
    <treasure>
        <beads id="61">
            <length>0.35</length>
            <material>Amber</material>
            <weight>0.052</weight>
            <thickness>0.02</thickness>
            <price>205</price>
        </beads>
    </treasure>
    <treasure>
        <beads id="62">
            <length>0.55</length>
            <material>Coral</material>
            <weight>0.110</weight>
            <thickness>0.03</thickness>
            <price>336</price>
        </beads>
    </treasure>
    <treasure>
        <beads id="63">
            <length>0.40</length>
            <material>Emerald</material>
            <weight>0.210</weight>
            <thickness>0.03</thickness>
            <price>984</price>
        </beads>
    </treasure>
    <treasure>
        <coulomb id="71">
            <material>gold</material>
            <size>3.5</size>
            <weight>40</weight>
            <form>square</form>
            <picture>false</picture>
            <price>140</price>
        </coulomb>
    </treasure>
    <treasure>
        <coulomb id="72">
            <material>silver</material>
            <size>5</size>
            <weight>55</weight>
            <form>round</form>
            <picture>true</picture>
            <price>75</price>
        </coulomb>
    </treasure>
    <treasure>
        <coulomb id="73">
            <material>bronze</material>
            <size>10</size>
            <weight>40</weight>
            <form>triangle</form>
            <picture>true</picture>
            <price>30</price>
        </coulomb>
    </treasure>
    <treasure>
        <cup id="81">
            <volume>65</volume>
            <material>gold</material>
            <weight>150</weight>
            <height>70</height>
            <price>250</price>
        </cup>
    </treasure>
    <treasure>
        <cup id="82">
            <volume>25</volume>
            <material>silver</material>
            <weight>70</weight>
            <height>45</height>
            <price>100</price>
        </cup>
    </treasure>
    <treasure>
        <cup id="83">
            <volume>25</volume>
            <material>bronze</material>
            <weight>45</weight>
            <height>55</height>
            <price>85</price>
        </cup>
    </treasure>
    <treasure>
        <vase id="91">
            <title>vasel</title>
            <type>new</type>
            <volume>150</volume>
            <hasPicture>true</hasPicture>
            <price>150</price>
        </vase>
    </treasure>
    <treasure>
        <vase id="92">
            <title>lase-vase</title>
            <type>old</type>
            <volume>160</volume>
            <hasPicture>false</hasPicture>
            <price>100</price>
        </vase>
    </treasure>
    <treasure>
        <vase id="93">
            <title>grandy</title>
            <type>historical</type>
            <volume>170</volume>
            <hasPicture>true</hasPicture>
            <price>300</price>
        </vase>
    </treasure>
    <treasure>
        <statue id="101">
            <title>NY</title>
            <weight>1000</weight>
            <size>3</size>
            <type>old</type>
            <creation_date>17.11.1996</creation_date>
            <creator>Leo</creator>
            <price>700</price>
        </statue>
    </treasure>
    <treasure>
        <statue id="102">
            <title>Paris</title>
            <weight>1400</weight>
            <size>2</size>
            <type>fashion</type>
            <creation_date>15.10.2001</creation_date>
            <creator>Dicaprio</creator>
            <price>6800</price>
        </statue>
    </treasure>
    <treasure>
        <statue id="103">
            <title>Great</title>
            <weight>560</weight>
            <size>1</size>
            <type>new</type>
            <creation_date>22.07.1996</creation_date>
            <creator>Vincent</creator>
            <price>5600</price>
        </statue>
    </treasure>
    <treasure>
        <painting id="111">
            <title>Street</title>
            <type>new</type>
            <creation_date>11.11.2011</creation_date>
            <creator>Michael</creator>
            <quality>excellent</quality>
            <paint_type>goodType</paint_type>
            <price>111</price>
        </painting>
    </treasure>
    <treasure>
        <painting id="112">
            <title>Home</title>
            <type>old</type>
            <creation_date>12.12.2012</creation_date>
            <creator>Brown</creator>
            <quality>average</quality>
            <paint_type>strangeType</paint_type>
            <price>222</price>
        </painting>
    </treasure>
    <treasure>
        <painting id="113">
            <title>Adventure</title>
            <type>modern</type>
            <creation_date>13.12.2007</creation_date>
            <creator>Harry</creator>
            <quality>good</quality>
            <paint_type>amazingType</paint_type>
            <price>333</price>
        </painting>
    </treasure>
    <treasure>
        <casket id="121">
            <size>10</size>
            <weight>1.2</weight>
            <hasLock>true</hasLock>
            <price>25</price>
        </casket>
    </treasure>
    <treasure>
        <casket id="122">
            <size>12</size>
            <weight>1.8</weight>
            <hasLock>false</hasLock>
            <price>20</price>
        </casket>
    </treasure>
    <treasure>
        <casket id="123">
            <size>15</size>
            <weight>2.5</weight>
            <hasLock>true</hasLock>
            <price>35</price>
        </casket>
    </treasure>
    <treasure>
        <key id="131">
            <size>3</size>